{"$schema":"https://json-schema.org/draft/2020-12/schema","additionalProperties":false,"description":"Public Ed25519 trust registry; semantic validation is enforced by dpslab.release_signing.","properties":{"identity":{"type":"object"},"integrity":{"type":"object"},"keys":{"type":"array","minItems":1},"schema_version":{"const":"0.1"}},"required":["schema_version","identity","keys","integrity"],"title":"DpsLab release trust registry 0.1","type":"object"}
