{"identity":{"content_version":"0.1.0","created_at":"2026-08-01T00:00:00Z","registry_id":"synthetic.release.trust.001"},"integrity":{"hash_algorithm":"sha256","registry_sha256":"794ca8962ee65ef80783654d9d0594f86052528b4e3a3e75bb1a326ea1a4de1c"},"keys":[{"algorithm":"ed25519","key_id":"synthetic.release.ed25519.001","public_key_base64":"A6EHv/POEL4dcN0Y50vAmWfk1jCbpQ1fHdyGZBJVMbg=","revocation_reason":null,"revoked_at":null,"rotated_from_key_id":null,"status":"trusted","valid_from":"2026-01-01T00:00:00Z","valid_until":"2027-01-01T00:00:00Z"}],"schema_version":"0.1"}
