{"identity":{"content_version":"0.1.0","created_at":"2026-08-01T15:27:15.167327Z","registry_id":"dpslab.release.trust.001"},"integrity":{"hash_algorithm":"sha256","registry_sha256":"4948b246303c99c7f7ead0f550baef75bd095ae375aa82e431caf96162c880d8"},"keys":[{"algorithm":"ed25519","key_id":"dpslab.release.ed25519.001","public_key_base64":"8FRdLwQtDDTooKp6HhZ9Bvt/kOAQfp/xebPfBKNKrHc=","revocation_reason":null,"revoked_at":null,"rotated_from_key_id":null,"status":"trusted","valid_from":"2026-08-01T15:25:53Z","valid_until":"2027-08-01T15:25:53Z"}],"schema_version":"0.1"}
